,video_id,comment_text,likes,replies,polarity
2384,JhA1Wi9mrns,Kid Rock was alright until he started hanging around hillbillies.,0,0,0.0
2385,JhA1Wi9mrns,Such a shame that this voice is wasted on meaningless lyrics about moronic redneck lifestyles.,0,0,-0.2333333333333333
2386,JhA1Wi9mrns,Kid Rock is a racist according to most people on the West Coast.  Is that a fact?,0,0,0.5
2387,JhA1Wi9mrns,I don't like it,0,0,0.0
2388,JhA1Wi9mrns,stuck in CA and only found demons,0,0,0.0
2389,JhA1Wi9mrns,Looser!,0,1,0.0
2390,JhA1Wi9mrns,Why does this sound like an ad? 😂😂,1,0,0.4
2391,JhA1Wi9mrns,He's singing about Tennessee mountain tops because there are no more mountain tops in West Virginia,3,1,-0.25
2392,JhA1Wi9mrns,holy fuck i dont think i have seen a bigger sell out in my life,4,1,-0.2
2393,JhA1Wi9mrns,I heard Kid Rock molests little boys,8,5,-0.1875
2394,JhA1Wi9mrns,Absolutely love an thanks for putting up.. not trying to be a ass but it's O'Keefe not oh Keith... O'Keefe is Great music school that's the only reason I wrote this!!!! But thanks for the video an of course I could be wrong....,0,1,0.19999999999999998
2395,JhA1Wi9mrns,This washed out loser still making shit music?  I really thought he was dead.  He should have stayed gone.  This douche is the epitome of what's wrong with America. He is also the epitome of Idiocracy prophecy come to fruition.,1,3,-0.175
2396,JhA1Wi9mrns,Fuck kid rock for hating on another American citizen # Colin kaepernick,3,1,-0.2
2397,JhA1Wi9mrns,"nazis and right wingers not welcomed in Boston. Stay the fuck out. Support Antifa, local socialists and IWW.",0,1,-0.038095238095238106
2398,EVp4-qjWVJE,Wow I know these are just highlights but wow the Semian made a bunch of crazy needle threading passes.,0,0,-0.13333333333333333
2399,EVp4-qjWVJE,Ppl always clown on the broncos. Yet we have the toughest division in the nfl. Our games are always so close.,0,0,0.0
2400,EVp4-qjWVJE,The Chargers have too many defensive weapons to be that timid early on. They honestly have the potential to be a top 5 defense in the league.,0,0,0.33999999999999997
2401,EVp4-qjWVJE,can't believe they lost the lead..,0,0,0.0
2402,EVp4-qjWVJE,He made his voice deeper at 2:40 in the 2nd quarter,0,0,0.0
2403,EVp4-qjWVJE,"The broadcasters were horrible, thanks for making us feel like you don't care about us, ESPN. Rex and some random lady, please hire an actual crew in the future. Somehow you make a great Broncos game feel like a chore. But it wasn't, was it? This was one of the best games all week!\n\nOn the Broncos front, we might have made a huge mistake by cutting TJ Ward and will be drafting Safety high next year. We still need a better O-line in places. Siemian improved a lot, Jamal Charles is old. Poor Jamal.",0,0,0.017333333333333333
2404,EVp4-qjWVJE,Can't believe my video 10 Kittens 1st Day Outside has over 2 million views now! \nGo check it out and hit that subscribe button!  xoxo Sarina 😊 \n\nhttps://youtu.be/DcJk32AJckg,0,0,0.0
2405,EVp4-qjWVJE,Rivers waits too long to get desperate..it takes 2 to 3 quarters to figurr out what is going on.  They use too many short runs down the middle.very predictable..He needs to throw more long balls and use Gates more often.,0,0,0.17777777777777778
2406,EVp4-qjWVJE,My west is looking good,0,0,0.7
2407,EVp4-qjWVJE,not trying to hear her deep ass voice,0,0,0.0
2408,EVp4-qjWVJE,"Commentator was pretty good, idk why everyone is complaining",0,0,0.475
2409,EVp4-qjWVJE,Rip ref like if u know what im talking about,0,0,0.0
2410,EVp4-qjWVJE,I don't like this sportscaster  sounds very annoying,0,0,-1.0
2411,EVp4-qjWVJE,"That's why San Diegians did not want to approve a new stadium on the ballot, just a waste of a new stadium good riddance",0,0,0.19318181818181818
2412,EVp4-qjWVJE,How is this 22 on trending,0,0,0.0
2413,EVp4-qjWVJE,Karma for the chargers leaving San Diego 🙃,0,0,0.0
2414,EVp4-qjWVJE,"Call me sexist if you want, but football doesn't sound right with a female commentator.",0,0,0.22857142857142856
2415,EVp4-qjWVJE,What's you're guys favorite NFL team? Mines the cowboys and ravens.,0,0,0.5
2416,EVp4-qjWVJE,"I'm all for equality but I didn't like the fact that a women was commentating pretty much the whole game, it kind of ruined it.",0,0,0.16999999999999998
2417,EVp4-qjWVJE,Who else saw the ref fall over at 1:44 😂😂😂,0,0,0.0
2418,EVp4-qjWVJE,1:42 look at the ref,0,0,0.0
2419,EVp4-qjWVJE,Who saw the ref eat it 1:40,0,0,0.0
2420,EVp4-qjWVJE,The ref falling at the top of the screen at 1:43 😂😂,0,0,0.5
2421,EVp4-qjWVJE,Game was good but the announcers made it as boring as possible,0,0,-0.17500000000000002
2422,EVp4-qjWVJE,"If your going to let the unsportsman like conduct of having time outs on kickers kicks, then you should at least show me the first kick that went over on the highlights NFL, if your too embarrassed to show the time out being used in such a way then outlaw it.",0,0,-0.016666666666666663
2423,EVp4-qjWVJE,The ref really falls though 🤣 1:43,0,0,0.2
2424,EVp4-qjWVJE,Did they get one of the lollypop kids to do play by play?,0,0,0.0
2425,EVp4-qjWVJE,"5 ads in a 10 minute video, da fuq?",0,0,0.0
2426,EVp4-qjWVJE,Afc west is afc best.,0,0,1.0
2427,EVp4-qjWVJE,The girl did just fine y'all are dicks.,0,0,0.4166666666666667
2428,EVp4-qjWVJE,Denver has a good QB idk why people are tripping bout him.......,0,0,0.7
2429,EVp4-qjWVJE,"You may think that the chargers lost...\n\n\n\n\nBut they didn't get injured, so thats a win in my book.",0,0,0.8
2430,EVp4-qjWVJE,How the anoucer pronounces some things is kind of irritating,0,0,0.09999999999999998
2431,EVp4-qjWVJE,I didn't know the NFL has Transgender sportscasters now.,0,0,0.0
2432,EVp4-qjWVJE,denver qb has a strong arm,1,0,0.4333333333333333
2433,EVp4-qjWVJE,Chargers 0-4 stay tuned for week 5,0,0,0.0
2434,EVp4-qjWVJE,I clicked for Sergio Dipp.  I was disappointed.,0,0,-0.75
2435,EVp4-qjWVJE,Just like the chargers CHOKE,0,0,0.0
2436,EVp4-qjWVJE,1:43 the ref got juked by casper,0,0,0.0
2437,EVp4-qjWVJE,YoungHOOOE!,0,0,0.0
2438,EVp4-qjWVJE,Replay of chargers vs broncos game last season chargers miss game tying field goal,0,0,-0.26666666666666666
2439,EVp4-qjWVJE,New color commentators...\n\nRomo: 10/10\nRyan: Boring/10,0,0,0.13636363636363635
2440,EVp4-qjWVJE,Peace olde,0,0,0.0
2441,EVp4-qjWVJE,1:42 the ref slips,0,0,0.0
2442,EVp4-qjWVJE,Thouchdown Los Angeles?,0,0,0.0
2443,EVp4-qjWVJE,Ellen DeGeneres is narrating the game?,0,0,-0.4
2444,EVp4-qjWVJE,Sad that Kasim Edebali is not playing,0,0,-0.5
2445,EVp4-qjWVJE,Came here for Sergio Dipps,1,0,0.0
2446,EVp4-qjWVJE,lol most accurate kicker in denver history and misses...  sportscaster jinxed it..,1,0,0.5666666666666668
2447,EVp4-qjWVJE,The ref falls at 1:45 lmao,1,0,0.6
2448,EVp4-qjWVJE,Did someone notice the referee on the uper side of the field? 1:37 :D,0,0,1.0
2449,EVp4-qjWVJE,At 1:43 that had to have hurt the ref 😂😂😂,0,0,0.0
2450,EVp4-qjWVJE,The commentator an 11 year old boy?,0,0,0.1
2451,EVp4-qjWVJE,@7:00 what IS pass interference then?,0,0,0.0
2452,EVp4-qjWVJE,yo watch the top of screen at 1:43 ref busts his ass lol,0,0,0.65
2453,EVp4-qjWVJE,"The sportscaster keeps rubbing it in with the, Los Angeles.",0,0,0.0
2454,EVp4-qjWVJE,"Siemian looks way better than he was last year, if our O Line can improve, we can definitely make the playoffs or who knows, maybe even the Super Bowl",0,0,0.20833333333333331
2455,EVp4-qjWVJE,This is why women should not commentate sporting events.. that 2nd & 19 run in the 3rd wasn't Fowler it was Sanders lmfaoo,0,0,0.0
2456,EVp4-qjWVJE,bro i saw this whole game omg i got pissed when the broncos coach called a timeout bc the kicker made it the first time smh sad,0,0,-0.1125
2457,EVp4-qjWVJE,the ref trips at 1:45,0,0,0.0
2458,EVp4-qjWVJE,Horrible announcers! Voice is awful for football. Had to turn the sound off to rewatch the highlights. Please don't let her do anymore Bronco games!,0,0,-0.5
2459,EVp4-qjWVJE,get women announcers out of the NFL,0,0,0.0
2460,EVp4-qjWVJE,Look at 1:42 and someone falls 😅😅,0,0,0.0
2461,EVp4-qjWVJE,"Listening to that commentary made my ears hurt. This sounded like a small town college football game being called on some hand me down equipment by a pair of freshman sports casting major students. If those two ever commentate on my team's game, I'm just going to have to watch the game on mute. #c'monman",0,0,-0.2571759259259259
2462,EVp4-qjWVJE,Anyone else see the ref fall at 1:42 lmao,0,0,0.6
2463,EVp4-qjWVJE,Gordon is doing the badgers proud,0,0,0.8
2464,EVp4-qjWVJE,"Half the comments are about the commentator. She is is being criticized far more than any other male commentators. People saying how she doesn't have a voice for tv, doesn't have a passion for football. Smh. Sexist people will find any reason to hold women back especially when they break into something as male dominated as football commentating.",0,0,0.03854166666666667
2465,EVp4-qjWVJE,The prepubescent caster just seems really unenthused with this game...,0,0,-0.1
2466,EVp4-qjWVJE,I still haven't gotten used to Phillis Rivers throwing motion,0,0,0.0
2467,EVp4-qjWVJE,Am I the only one who went back like 4 times to watch the ref fall? 😂,0,0,0.0
2468,EVp4-qjWVJE,Average Broncos team against a shitty Chargers team.  Raiders have no AFC West issues this year.\nAnd yes I know about KC's once in a lifetime game last week.  Same scenario.,0,0,-0.1375
2469,EVp4-qjWVJE,Ash ketchum finally grew up and got a real job. Give up on your dreams,0,0,0.1
2470,EVp4-qjWVJE,"When I heard the commentating, I thought it was Paula Poundstone.",0,0,0.0
2471,EVp4-qjWVJE,"Oh my, please dont let this woman call anymore games",0,0,0.0
2472,EVp4-qjWVJE,Super charged losers. At least they're not degrading San Diego anymore.,0,0,-0.05555555555555556
2473,EVp4-qjWVJE,That lady commentator is annoying af. Sound like kermit the frog 🐸,0,0,-0.2
2474,EVp4-qjWVJE,Chargers chokes on a game-changing goal again. poor Rivers,0,0,-0.4
2475,EVp4-qjWVJE,The Siemian is in... AGAIN!!,0,0,0.0
2476,EVp4-qjWVJE,Greatest charger comeback in nfl history thumbs up if you agree GO Bolts,0,0,1.0
2477,EVp4-qjWVJE,I don't give a f@#* San Diego Charges 4 life,0,0,0.0
2478,EVp4-qjWVJE,Did anybody see the referee fall😂😂,0,0,0.0
2479,EVp4-qjWVJE,1:42 look at the ref,1,0,0.0
2480,EVp4-qjWVJE,"nice kick woo flug poo , chargers suck and will always suck, have fun with your team l.a.",1,0,0.44999999999999996
2481,EVp4-qjWVJE,So y'all just gon ignore that Sanders got 6 chargers defenders ankles.,1,0,0.0
2482,EVp4-qjWVJE,commentators are awful,0,0,-1.0
2483,EVp4-qjWVJE,http://www.geoengineeringwatch.org/,0,0,0.0
2484,EVp4-qjWVJE,Most annoying announcer ever,0,0,-0.15000000000000002
2485,EVp4-qjWVJE,https://youtu.be/qku2WZ7aRYw,0,0,0.0
2486,EVp4-qjWVJE,Wow the videos aw trending now,0,0,0.1
2487,EVp4-qjWVJE,LAme,0,0,-0.5
2488,EVp4-qjWVJE,Chargers played well,0,0,0.0
2489,EVp4-qjWVJE,Poor Charles,0,0,-0.4
2490,EVp4-qjWVJE,nooooooooooo,0,0,0.0
2491,EVp4-qjWVJE,I blame feeney lol,0,0,0.8
2492,EVp4-qjWVJE,1:41 that ref busted his ass,0,0,0.0
2493,EVp4-qjWVJE,Goooo BRONCOS!!,0,0,0.0
2494,EVp4-qjWVJE,Who replayed that referee falling?,0,0,0.0
2495,EVp4-qjWVJE,Rivers wastes careers.,1,0,-0.2
2496,EVp4-qjWVJE,Chargers all over Fowler.. flag!,1,0,0.0
2497,EVp4-qjWVJE,Football is for faggots 🏈=💁🏼,0,0,0.0
2498,LcZ2AuvxXNA,They must of done thousands of retakes and fake laughs 😂,3,0,-0.5
2499,LcZ2AuvxXNA,"An alle deutschen, lässt uns so tun als ob dieser Kommentar total lustig wäre",1,0,0.0
2500,LcZ2AuvxXNA,Yall should make a full Arrow Movie 😊 vs Avengers,1,0,0.35
2501,LcZ2AuvxXNA,The Group Pro League History Like Mi coment!!! CRACK,0,0,0.0
2502,LcZ2AuvxXNA,How long does it take to do the videos please like so they can see this comment,1,0,-0.05
2503,LcZ2AuvxXNA,Do a first try edition plz,1,0,0.25
2504,LcZ2AuvxXNA,Who agrees that they need to make hockey trick shots,1,0,0.0
2505,LcZ2AuvxXNA,if I could subscribe to Dude Perfect a million times I would,1,0,1.0
2506,LcZ2AuvxXNA,Definitely skilled !!!,1,0,0.9765625
2507,LcZ2AuvxXNA,You guys should make dude perfect sceets,0,0,1.0
2508,LcZ2AuvxXNA,SIMPLE GEOMETRY,1,0,0.0
2509,LcZ2AuvxXNA,I wonder how many takes they needed to get all the shots right.,0,0,0.39285714285714285
2510,LcZ2AuvxXNA,kinda wack.. not as much effort in these videos,0,0,0.2
2511,LcZ2AuvxXNA,I can only imagine how many retakes they must have done to get this video so perfect. You guys are amazing!,0,0,0.5625
2512,LcZ2AuvxXNA,All these 'trick shots' are losing credibility because of how poor these shots are,1,0,-0.4
2513,LcZ2AuvxXNA,The only unique channel,1,0,0.1875
2514,LcZ2AuvxXNA,Can you do a video revealing the panda in the mask,0,0,0.0
2515,LcZ2AuvxXNA,"nerf bows are all about a piece of plastic + elastic string. normal bowstrings don't stretch, it's the bow limbs that do the work",0,0,0.15
2516,LcZ2AuvxXNA,How many times did they do each trick shot,0,0,0.5
2517,LcZ2AuvxXNA,who else gets annoyed by how excited they get,0,0,-0.012500000000000011
2518,LcZ2AuvxXNA,Arrow Season 6 is looking pretty good.,0,0,0.475
2519,LcZ2AuvxXNA,It wouldn't be dude perfect without obnoxious Americans screaming every two fucking seconds,0,0,0.2
2520,LcZ2AuvxXNA,lol their reactions are so fake now,0,0,0.15000000000000002
2521,LcZ2AuvxXNA,You should have 4 people hit the gong in a row from the roof,0,0,0.0
2522,LcZ2AuvxXNA,What a bunch of douchers,0,0,0.0
2523,LcZ2AuvxXNA,Stop putting the twins in got to be the worst part of this skit it would be way better if they wasn't in it like the old day,0,0,-0.13333333333333333
2524,LcZ2AuvxXNA,I think this is one of the most fastest growing channel on YouTube. Quality content,0,0,0.5
2525,LcZ2AuvxXNA,"What, slow day at the frat?",0,0,-0.30000000000000004
2526,LcZ2AuvxXNA,Please make a monster jam trick shots,0,0,0.0
2527,LcZ2AuvxXNA,"So what this video tells us, is that they' ve just discovered something else they can make easy.",0,0,0.43333333333333335
2528,LcZ2AuvxXNA,"nah I think I'm gonna attempt it, how else am I gonna get as good as Dude Perfect?",0,0,0.85
2529,LcZ2AuvxXNA,Rises more than a thousand Suns 0.50,0,0,0.5
2530,LcZ2AuvxXNA,the clip with the red balloon reminded me of the movie IT🤡,0,0,0.0
2531,LcZ2AuvxXNA,They're even better than Hanzo!,0,0,0.625
2532,LcZ2AuvxXNA,Earlier you were making videos without any promotion... now its about 1-2 weeks until another video comes online but with promotion..,0,0,0.0
2533,LcZ2AuvxXNA,what do you call a boomerang which does not comes back\na stick,0,0,0.0
2534,LcZ2AuvxXNA,Way to excited about all of it...,0,0,0.375
2535,LcZ2AuvxXNA,This seemed fake compared to there others.,0,0,-0.5
2536,LcZ2AuvxXNA,Sub to my channel,0,0,0.0
2537,LcZ2AuvxXNA,Can you guy's mirror ?,0,0,0.0
2538,LcZ2AuvxXNA,why do you have to scream everytime you blow something up? are you guys autistic?,0,0,-0.2
2539,LcZ2AuvxXNA,i love your videos,0,0,0.5
2540,LcZ2AuvxXNA,"What sort of piece of shit would downvote DudePurfect videos, as if they could do better themselfs.",0,0,0.15
2541,LcZ2AuvxXNA,o ma gad .... it the hawkeyeS,0,0,0.0
2542,LcZ2AuvxXNA,I think after a long time ty has not done the starting trick shot,0,0,-0.025
2543,LcZ2AuvxXNA,I just got hit by the same hurricane as you,0,0,0.0
2544,LcZ2AuvxXNA,To be a dude perfect member it is so awesome ....,0,0,1.0
2545,LcZ2AuvxXNA,You realize how long it must take to film these vids  lol,0,0,0.375
2546,LcZ2AuvxXNA,guys ur like gods. \nI want to join.🙏🙏🙏,0,0,0.0
2547,LcZ2AuvxXNA,Can you shoot a video with some Indian things for the people in India,0,0,0.0
2548,LcZ2AuvxXNA,I can only imagine how many times they had to film that pool table trick shot.,0,0,0.25
2549,LcZ2AuvxXNA,Dude Perfect should do a collab with the slo mo guys,0,0,1.0
2550,LcZ2AuvxXNA,Wonder how much they celebrate when one of them takes a dump and don't leave any skid marks!,0,0,0.25
2551,LcZ2AuvxXNA,"Heya Guys! You Can Try Either of the following:\n1: World's Highest Strike From 25km High!\n2: Longest Bottle Busta Ft. Bow & Arrow From 1m Long!\nOr 3: Highest Basketball Pringles Laser Shot From 125 stories High! Reply With With What To Film, Guys!👊🏿🙇🏽👋",0,0,0.2
2552,LcZ2AuvxXNA,So easy  ! Never ever waste food. Time to cook. Sub us if you want to learn from CHEFS.,0,0,0.17083333333333336
2553,LcZ2AuvxXNA,"Love ur nickaloadian show, nice job, u guys are my heros",0,0,0.55
2554,LcZ2AuvxXNA,Omg how are they so good like bro i acnr even shot a nerf bow😅😅😅😅,0,0,0.7
2555,LcZ2AuvxXNA,that panda's dance😂😂,0,0,0.0
2556,LcZ2AuvxXNA,Do these guys have a whole warehouse just for trick shots???,0,0,0.2
2557,LcZ2AuvxXNA,Dress the panda up as pandalf,0,0,0.0
2558,LcZ2AuvxXNA,the cody trust stort is excellent,0,0,1.0
2559,LcZ2AuvxXNA,Is this all are fake,0,0,-0.5
2560,LcZ2AuvxXNA,Awesome. I wonder how many takes / how much practice was needed to prepare?,0,0,0.5666666666666667
2561,LcZ2AuvxXNA,love how fake thay are,0,0,0.0
2562,LcZ2AuvxXNA,New Lars Andersen? xD,0,0,0.13636363636363635
2563,LcZ2AuvxXNA,Çevirmen ben senin amk dkdnekbdowdboecowbe,0,0,0.0
2564,LcZ2AuvxXNA,I subscribe :D lol,0,0,0.9
2565,LcZ2AuvxXNA,Yes Panda!!!,0,0,0.0
2566,LcZ2AuvxXNA,הי,0,0,0.0
2567,LcZ2AuvxXNA,You are amazing !,0,0,0.7500000000000001
2568,LcZ2AuvxXNA,Call Cory curry,0,0,0.0
2569,LcZ2AuvxXNA,how many trys ?,0,0,0.5
2570,LcZ2AuvxXNA,Cory finally wasn't bottle busted,0,0,0.0
2571,LcZ2AuvxXNA,RYU GA WAGA TEKI WOU KUROU!,0,0,0.0
2572,LcZ2AuvxXNA,Thas is so cool videos,0,0,0.35
2573,LcZ2AuvxXNA,I like the swinging Swisher shot,0,0,0.0
2574,LcZ2AuvxXNA,Please,0,0,0.0
2575,LcZ2AuvxXNA,awesome,0,0,1.0
2576,LcZ2AuvxXNA,*_**DO NOT ATTEMPT**_*,0,0,0.0
2577,LcZ2AuvxXNA,they deserve more subs,0,0,0.5
2578,LcZ2AuvxXNA,View bots?🤔,0,0,0.0
2579,LcZ2AuvxXNA,back to kindergarden ?,0,0,0.0
2580,LcZ2AuvxXNA,Pleasee a new marksman edition,0,0,0.13636363636363635
2581,LcZ2AuvxXNA,f of,0,0,0.0
2582,LcZ2AuvxXNA,hi,0,0,0.0
2583,LcZ2AuvxXNA,whos in the panda costume,0,0,0.0
2584,LcZ2AuvxXNA,Super,0,0,0.3333333333333333
2585,LcZ2AuvxXNA,Fucking crying,0,0,-0.2
2586,LcZ2AuvxXNA,cool,0,0,0.35
2587,LcZ2AuvxXNA,Soo cool,0,0,0.35
2588,LcZ2AuvxXNA,Nice video,0,0,0.6
2589,LcZ2AuvxXNA,"остыньте! ,вас наебали",0,0,0.0
2590,LcZ2AuvxXNA,日本人おるかー！,0,0,0.0
2591,LcZ2AuvxXNA,dantdm is comeing,0,0,0.0
2592,LcZ2AuvxXNA,They are hackers.,0,0,0.0
2593,LcZ2AuvxXNA,Very nice,0,0,0.78
2594,LcZ2AuvxXNA,Yu,0,0,0.0
2595,LcZ2AuvxXNA,They surpassed pewdiepie,0,0,0.0
2596,LcZ2AuvxXNA,Nada como bons cálculos de física...,0,0,0.0
2597,LcZ2AuvxXNA,"Hi, if your reading this, I just want you to have a good day. I have a small channel with very few subscribers, but I'll really appreciate it if you gave my videos a chance. Sorry to bother you",1,0,-0.02200000000000001
2598,MdzGZv3zQ-U,What shoes action b have on??,0,0,0.1
2599,MdzGZv3zQ-U,What a great episode. I loved every moment of it. :-) Keep up the great work you guys and keep them coming. I liked the different style of it from Hot Ones and this was a pleasure to watch.,0,0,0.5214285714285715
2600,MdzGZv3zQ-U,Ruin it with white Wonder bread.,0,0,0.0
2601,MdzGZv3zQ-U,Probably the whitest cast on YouTube,0,0,0.0
2602,MdzGZv3zQ-U,I'd give me my left nut for either of those sandwich.,0,0,0.0
2603,MdzGZv3zQ-U,He's always super baked.,0,0,0.3333333333333333
2604,MdzGZv3zQ-U,Can't believe my video 10 Kittens 1st Day Outside has over 2 million views now! \nGo check it out and hit that subscribe button!  xoxo Sarina 😊 \n\nhttps://youtu.be/DcJk32AJckg,0,0,0.0
2605,MdzGZv3zQ-U,Shout out to Primanti's here in Pittsburgh!!,0,0,0.0
2606,MdzGZv3zQ-U,"Can you three start a show,,,,, you would break youtube",0,0,0.0
2607,MdzGZv3zQ-U,If Mario was drunk he would have chosen Sean's,0,0,-0.5
2608,MdzGZv3zQ-U,Does anybody know what kind of cheese Action used? I can't get the spelling,0,0,0.35
2609,MdzGZv3zQ-U,this is the content I crave,0,0,0.0
2610,MdzGZv3zQ-U,I'd let them sandwich me,0,0,0.0
2611,MdzGZv3zQ-U,Mario Batali looks like the wizard from the wizard of oz. shits hilarious,0,0,0.5
2612,MdzGZv3zQ-U,Love how he says chicharon with a french accent. LOL,0,0,0.43333333333333335
2613,MdzGZv3zQ-U,Aahhaah funniest part when mario gets the money,0,0,0.0
2614,MdzGZv3zQ-U,Mario is the man.  Those sandwiches made me hungry as hell.,0,0,0.0
2615,MdzGZv3zQ-U,"Action, Sean and Mario in one video this is a gift from God",0,0,0.1
2616,MdzGZv3zQ-U,"Just when I thought this channel couldn't get any better, they bring Action Bronson and Mario Batali in for a sandwich showdown. Anthony Bourdain has to be next.",0,0,0.19999999999999998
2617,MdzGZv3zQ-U,Now I'm hungry for some sandwiches.,0,0,0.0
2618,MdzGZv3zQ-U,You know Bronson loves to cook when he cook's his opponent's submission too lol,0,0,0.8
2619,MdzGZv3zQ-U,i wish i could eat ass like mario batali eats a sandwich,0,0,0.0
2620,MdzGZv3zQ-U,Fuck! Now I'm hungry lol,0,0,0.15000000000000002
2621,MdzGZv3zQ-U,oh man I love Action Bronson we went to the same Hebrew School in Brooklyn L'Chaim!,0,0,0.19999999999999998
2622,MdzGZv3zQ-U,"Not gonna lie, the first time I saw BamBam on hot ones I thought he was a bit of a dick. But now the more I see of y'all collaborating the more he comes off chill, and personable.",0,0,0.375
2623,MdzGZv3zQ-U,I just bought the book,0,0,0.0
2624,MdzGZv3zQ-U,those look so much better on bruce lee,0,0,0.5
2625,MdzGZv3zQ-U,Such a great episode,0,0,0.4
2626,MdzGZv3zQ-U,I want Sean to give me some bowl tossing action... if you know what I mean...,0,0,-0.10625
2627,MdzGZv3zQ-U,Sean just has to get fat to fit into his network,0,0,0.4
2628,MdzGZv3zQ-U,"I love bronson but every food he makes is a fucking mess, probably tastes great but doesnt look fun to eat at all..  and sean,for someone who dislikes trump you sure do like using his phrases.",0,0,0.385
2629,MdzGZv3zQ-U,You manage to get hold of people like Matty Matheson AND Action on top of all your other guests? This channel is killing it.,0,0,0.15833333333333333
2630,MdzGZv3zQ-U,Lol its a fat covered sandwich topped with fat of course it tastes amazing!!!,0,0,0.9
2631,MdzGZv3zQ-U,sean evans is speaking to the dominican in me with that salami,0,0,0.0
2632,MdzGZv3zQ-U,"Oh hell yeah guys, because there is nothing more appetizing than watching three fat, bald, white American slobs sucks each other off. Get the fuck out...",0,0,-0.017857142857142867
2633,MdzGZv3zQ-U,who eats sandwiches like those?? they're huge!!! :D,0,0,0.890625
2634,MdzGZv3zQ-U,I wish my first name was Action.  It probably should be.,0,0,0.175
2635,MdzGZv3zQ-U,Most 420 friendly sandwiches I've ever seen.,0,0,0.4375
2636,MdzGZv3zQ-U,He needs a hairnet over that beard. Also it's not good to eat the cheese before you make the sammy because it becomes too familiar by the time you eat the sammy and it DETRACTS FROM THE MEAL.,0,0,0.012500000000000011
2637,MdzGZv3zQ-U,if i only find a girl looking at me like the guy looks at the sandwich at 6:45,0,0,0.0
2638,MdzGZv3zQ-U,this fat boi looks like that noah ritter kid from ellen in about 25 years,0,0,0.0
2639,MdzGZv3zQ-U,Bronson needs his own restaurant and I need to visit,0,0,0.6
2640,MdzGZv3zQ-U,I'm not impressed.,0,0,-0.5
2641,MdzGZv3zQ-U,"No homo, but Action Bronson has pretty eyes",0,0,0.175
2642,MdzGZv3zQ-U,"Great chemistry between sean and bigsexyDaddy! U guys need to make more content, i rather watch this than porn.",0,0,0.75
2643,MdzGZv3zQ-U,Everything Action does is GOLD!,0,0,0.125
2644,MdzGZv3zQ-U,its sucks he didnt ask about tyler the creator in the who dat boy video,0,0,-0.3
2645,MdzGZv3zQ-U,Action Bronson: I don't know it's just left over so I said 'fuck it!' .\nI cook like that tool :D And these are words of wisdom!,0,0,0.15
2646,MdzGZv3zQ-U,Action Bronson is the highest person I've ever seen,0,0,0.1
2647,MdzGZv3zQ-U,"I've been the best since I step in, take a hooker to the motherfucking Jetson",0,0,1.0
2648,MdzGZv3zQ-U,I'm a day 1 fan and i only just realised how beautiful action's eyes really are hahaha,0,0,0.26999999999999996
2649,MdzGZv3zQ-U,came to FWF for hot ones stayed for Sean the GOAT,0,0,0.25
2650,MdzGZv3zQ-U,No wonder that guy is fat,0,0,0.0
2651,MdzGZv3zQ-U,Does anyone know the shirt Bronson is wearing? Summer is on its way and that shirt seems A+,0,0,0.0
2652,MdzGZv3zQ-U,My internet-food-gods 😍 just babish and brad from bon appetit are missing,0,0,-0.2
2653,MdzGZv3zQ-U,Oh god! They brought up the chicharron and I lost it. I Gotta make it.,0,0,0.0
2654,MdzGZv3zQ-U,i feel like someone crept my youtube history and then compiled it all into one video. these are two of my favorite dudes.,0,0,0.5
2655,MdzGZv3zQ-U,Mario needs to just give up and lose the hair.....like yesterday.,0,0,0.0
2656,MdzGZv3zQ-U,*Adds an assload of sugar*\nYou don't want it to be too sugary,0,0,0.0
2657,MdzGZv3zQ-U,I like sandwich to sandwich. Just didn't know it was two guys.,0,0,0.0
2658,MdzGZv3zQ-U,I have absolutely no idea who action johnson is...,0,0,0.0
2659,MdzGZv3zQ-U,0:24 Back in the building but you outside,0,0,0.0
2660,MdzGZv3zQ-U,"I think, technically, Action made both those sammiches....give me moar Action B please!",0,0,0.1125
2661,MdzGZv3zQ-U,Mario needs to shave that head,0,0,0.0
2662,MdzGZv3zQ-U,"Yo fat guy, do you even know what chicharon means. Stupid ass mf",0,0,-0.7999999999999999
2663,MdzGZv3zQ-U,"Batali is an old, flamboyant, slob who is trying way too hard to stay relevant.",0,0,0.06944444444444445
2664,MdzGZv3zQ-U,I love Action has Supreme confidence when in reality he has no idea what he is talking about. He is a cook at best and I don't think even he would call himself a chef.,0,0,0.5333333333333333
