,video_id,comment_text,likes,replies,polarity
3367,a7Sf_H2cFdM,"Wait, how is this trending? 😂",0,0,0.0
3368,a7Sf_H2cFdM,Trending?!?,0,0,0.0
3369,a7Sf_H2cFdM,wow\n#4 on trending,0,0,0.0
3370,a7Sf_H2cFdM,grats on 2nd on trending!,0,0,0.0
3371,a7Sf_H2cFdM,How is this trending ? Awful,0,0,-1.0
3372,a7Sf_H2cFdM,#2 on trending!!!!!!,0,0,0.0
3373,a7Sf_H2cFdM,#2 on trending,0,0,0.0
3374,a7Sf_H2cFdM,Rooster Teeth? great......\nsee more    https://goo.gl/3V48q4,0,0,0.5
3375,a7Sf_H2cFdM,I like hairy man,0,0,0.0
3376,a7Sf_H2cFdM,Wow #13 on trending,1,0,0.1
3377,a7Sf_H2cFdM,This made the trending page? SIIICCK.,0,0,0.0
3378,a7Sf_H2cFdM,He didn't disengage,0,0,0.0
3379,a7Sf_H2cFdM,RvB 16?,0,0,0.0
3380,a7Sf_H2cFdM,Everyone's an amputee!,0,0,0.0
3381,a7Sf_H2cFdM,RTAA #2 on trending? It's lit,1,0,0.0
3382,a7Sf_H2cFdM,Rooster teeth TRENDING!!!!,1,0,0.0
3383,a7Sf_H2cFdM,Who still watches rooster teeth,0,0,0.0
3384,a7Sf_H2cFdM,Trending,0,0,0.0
3385,a7Sf_H2cFdM,Daamn,0,0,0.0
3386,a7Sf_H2cFdM,That oldman has no teeth.,0,0,0.0
3387,a7Sf_H2cFdM,How is Rooster teeth 11 on trending,0,0,0.0
3388,a7Sf_H2cFdM,the booie,0,0,0.0
3389,a7Sf_H2cFdM,https://jsitblogblog.wordpress.com/,0,0,0.0
3390,a7Sf_H2cFdM,Oh Brandon.... simple simple Brandon...,1,0,0.0
3391,a7Sf_H2cFdM,666 dislikes wierd,1,0,0.0
3392,a7Sf_H2cFdM,Small YouTuber here! I would love to get some constructive feedback. :),1,1,0.22916666666666666
3393,a7Sf_H2cFdM,Taylor Swift Ready For It? official Music video \nhttps://www.youtube.com/watch?v=hDlyhXdJN7s,1,0,0.2
3394,a7Sf_H2cFdM,This.. Is in trending.,1,1,0.0
3395,a7Sf_H2cFdM,Brandon is the less interesting person in the world,0,1,0.16666666666666669
3396,a7Sf_H2cFdM,veiculos,0,1,0.0
3397,a7Sf_H2cFdM,ayy number 10 on the trending page well done guys,0,1,0.0
3398,oDIDZ9EmQfA,More subscribers than jake or Logan Paul,4,0,0.5
3399,oDIDZ9EmQfA,I love Derek,0,0,0.5
3400,oDIDZ9EmQfA,Follow me on musicak.ly @ jailynn.queen,0,0,0.0
3401,oDIDZ9EmQfA,Happy,0,0,0.8
3402,oDIDZ9EmQfA,that intro 😍😍😍👍👍,0,0,0.0
3403,oDIDZ9EmQfA,Yayayayaya,0,0,0.0
3404,oDIDZ9EmQfA,I also have Trypophobia,0,0,0.0
3405,oDIDZ9EmQfA,Wait ur name Rachel? I 2,0,0,0.0
3406,oDIDZ9EmQfA,That thumbnail looks familiar,0,0,0.375
3407,oDIDZ9EmQfA,You cheater you love ?!😗forgit his name!,0,0,0.78125
3408,oDIDZ9EmQfA,Irish names 👍🏼👍🏼,0,0,0.0
3409,oDIDZ9EmQfA,2:38  You're welcome,0,0,0.8
3410,oDIDZ9EmQfA,Under vlogs\n\n\nLove it,0,0,0.0
3411,oDIDZ9EmQfA,OMG DEREK I LOVE DEREK,0,0,0.5
3412,oDIDZ9EmQfA,"Yass Rcl vlogs, dream come true!!!",0,0,0.68359375
3413,oDIDZ9EmQfA,OH hi caoimhe,0,0,0.0
3414,oDIDZ9EmQfA,Fear :small hole?,0,0,-0.25
3415,oDIDZ9EmQfA,OMG DEREK YESSSS,0,0,0.0
3416,oDIDZ9EmQfA,Hello,0,0,0.0
3417,oDIDZ9EmQfA,OMG OMG OMG OMG DEREK AHHHHH I DIDNT KNOW YALL A FRIENDS IM SHOOKETH,0,0,0.0
3418,oDIDZ9EmQfA,Deutschland Hose 😂,0,0,0.0
3419,oDIDZ9EmQfA,DEREKKKK,0,0,0.0
3420,oDIDZ9EmQfA,is Derrick's nails painted,0,0,0.0
3421,oDIDZ9EmQfA,YAY! I need more Rachel videos❤,0,0,0.5
3422,oDIDZ9EmQfA,Isn't that scary,0,0,-0.5
3423,oDIDZ9EmQfA,The intro😻😻,0,0,0.0
3424,oDIDZ9EmQfA,Omg derek kildall!!,0,0,0.0
3425,oDIDZ9EmQfA,ew derek,0,0,0.0
3426,oDIDZ9EmQfA,OMG DEREK AHHHHH,0,0,0.0
3427,oDIDZ9EmQfA,Was he wereing nail polish,0,0,0.0
3428,oDIDZ9EmQfA,I love Derek,0,0,0.5
3429,oDIDZ9EmQfA,DEREK OMFG YASSS QUEEN SLAY,0,0,0.0
3430,oDIDZ9EmQfA,Idea from dudesons?,0,0,0.0
3431,oDIDZ9EmQfA,OMG I LOVE DEREK,0,0,0.5
3432,oDIDZ9EmQfA,what about hurricane irma stay safe 😓😲😢,0,0,0.5
3433,oDIDZ9EmQfA,beauty sos,0,0,0.0
3434,oDIDZ9EmQfA,Kweeva seems so rude omg,0,0,-0.3
3435,oDIDZ9EmQfA,I FRICKING LOVE DEREK OMFG,0,0,0.5
3436,oDIDZ9EmQfA,Smh just call his phone!!,0,0,0.0
3437,oDIDZ9EmQfA,5:37 - 5:40 dead meme,0,0,-0.2
3438,oDIDZ9EmQfA,Snap family 😊😊,0,0,0.0
3439,oDIDZ9EmQfA,OMG I loveeeee how she's starting vlogs,0,0,0.0
3440,oDIDZ9EmQfA,The wokers are so done XD,0,0,0.0
3441,oDIDZ9EmQfA,That intro dohhhhhh!!!   I could never think of that name haha,0,0,0.2
3442,oDIDZ9EmQfA,Did the phone got found?😂,0,0,0.0
3443,oDIDZ9EmQfA,Tyler is a Hufflepuff. End of story! \n\n\n\n\n\nI LOVE HIM SO MUCH!!!!!!!!,0,0,0.75
3444,oDIDZ9EmQfA,I just paid you,0,0,0.0
3445,oDIDZ9EmQfA,8 use to live in Washington state in yelm,0,0,0.13636363636363635
3446,oDIDZ9EmQfA,why does caoimhe look so much like jane from jane the virgin,0,0,0.2
3447,oDIDZ9EmQfA,"when i saw derek i screamed, i love him so muchhhh😍😍",0,0,0.5
3448,oDIDZ9EmQfA,Can't believe my video 10 Kittens 1st Day Outside has over 2 million views now! \nGo check it out and hit that subscribe button!  xoxo Sarina 😊 \n\nhttps://youtu.be/DcJk32AJckg,0,0,0.0
3449,oDIDZ9EmQfA,Do the eat it or wear it challenge with Tyler,0,0,0.0
3450,oDIDZ9EmQfA,Who else kinda misses Rachel's old friends? 😬,0,0,0.1
3451,oDIDZ9EmQfA,Why didn't you just call him when he lost his phone?,0,0,0.0
3452,oDIDZ9EmQfA,I was born in the same place as Tyler PHILLY,0,0,0.0
3453,oDIDZ9EmQfA,The Only Person Who Didn't Break A Shape...\nRachel XD,0,0,0.0
3454,oDIDZ9EmQfA,who else thinks the under vlogs should make a separate channel,0,0,0.0
3455,oDIDZ9EmQfA,Is that the Tyler in bramty’s vids???,0,0,0.0
3456,oDIDZ9EmQfA,OMG I LOOVE DEREK FROM MUSICALY HE IS MY ICON,0,0,0.0
3457,oDIDZ9EmQfA,did tyler ever get his phone back? xD,0,0,0.0
3458,oDIDZ9EmQfA,One of the best vlog intros ever,0,0,1.0
3459,oDIDZ9EmQfA,7:06 cutest moment ever! when Rachel fell Tyler asked if she is okay? SO CUTTTTEEEE!!!,0,0,0.9765625
3460,oDIDZ9EmQfA,I love Rachel and Derek omi me they collabed 😍💗💖💖,0,0,0.5
3461,oDIDZ9EmQfA,U could of just called Tyler's phone,0,0,0.0
3462,oDIDZ9EmQfA,If it wasnt already broken you definitely would have broken it 😂😂,0,0,-0.26666666666666666
3463,oDIDZ9EmQfA,Did Tyler find his phone,0,0,0.0
3464,oDIDZ9EmQfA,To find Tyler's phone... Why don't they just call his phone so his phone would ring and it would be easier for them to find it? Rip Tyler's phone... ;(,0,0,0.0
3465,oDIDZ9EmQfA,You are copying The dudesons,0,0,0.0
3466,oDIDZ9EmQfA,You could have just called the phone to find it you know.... Use your other sinces you weren't born with only eyes,0,0,-0.0625
3467,oDIDZ9EmQfA,So did you find his phone?,0,0,0.0
3468,oDIDZ9EmQfA,The thumbnail reminds me the show hole in the wall,0,0,0.0
3469,oDIDZ9EmQfA,Okay.. because of the end i think taylor has lost his phone forever.. R.I.P Phone :c :D,0,0,0.25
3470,oDIDZ9EmQfA,They should have just called his phone😂,0,0,0.0
3471,oDIDZ9EmQfA,I luv this💖,0,0,0.0
3472,oDIDZ9EmQfA,Rachel you're too goood  😆😆😆😘😘😘,0,0,0.0
3473,oDIDZ9EmQfA,Derek ❤️,1,0,0.0
3474,oDIDZ9EmQfA,That...........was............AMAZING,0,0,0.0
3475,oDIDZ9EmQfA,Hello everyone!!!!,0,0,0.0
3476,oDIDZ9EmQfA,36 on trending list!,0,0,0.0
3477,oDIDZ9EmQfA,Love that series!!!,1,0,0.9765625
3478,oDIDZ9EmQfA,Love these Vlogsss,0,0,0.5
3479,oDIDZ9EmQfA,Hi,0,0,0.0
3480,oDIDZ9EmQfA,Is that guy with the blue hair gay? His fingernails are painted!,0,0,0.2604166666666667
3481,oDIDZ9EmQfA,9:14 am I hearing an angel,0,0,0.0
3482,oDIDZ9EmQfA,I follow Derik on musicly he's my fave musers ❤️🔥,1,0,0.0
3483,oDIDZ9EmQfA,Why didn't you just call the phone so you could hear where it is 😂,1,0,0.0
3484,oDIDZ9EmQfA,Am I the only one who thought that was the Dolan twins foam pit?,1,0,0.0
3485,oDIDZ9EmQfA,My middle name is Caoimhe and you pronounce it Ceeva lol,1,0,0.4
3486,oDIDZ9EmQfA,I actually want to know if he found his phone LMAO 😂😂😂😂,1,0,0.3
3487,oDIDZ9EmQfA,Make a vlog channel,0,0,0.0
3488,oDIDZ9EmQfA,OMG MY NAMES CAOIMHE!!! I've never heard of anyone else with that name😊 ( if you are wondering why my profile name is spelt like keeva it's because nobody would understand what it means),0,2,0.0
3489,oDIDZ9EmQfA,OH MY GOD DO MORE VLOGS,0,2,0.5
3490,oDIDZ9EmQfA,CAN I GET A HOOOOOOOOOYYYAAAAAAAAAAAAA,0,1,0.0
3491,oDIDZ9EmQfA,4:13 😂😂,2,1,0.0
3492,oDIDZ9EmQfA,The person with nail polish is that person a boy or a giel,0,1,0.0
3493,oDIDZ9EmQfA,12 million,0,1,0.0
3494,oDIDZ9EmQfA,Did you find the phone??????📱📱📱📱📱📱📱📱📱📱📱,0,1,0.0
3495,oDIDZ9EmQfA,How awesone was that intro thoo!!!!😇😇😇😳,0,1,0.0
3496,oDIDZ9EmQfA,"I LOVE DEREK, I LOVE HIS MUSICAL.LYS",0,1,0.5
3497,oDIDZ9EmQfA,That intro was lit,0,1,0.0
3498,zAtHxJvSczA,all too well is not just A song is THE song,11,0,0.0
3499,zAtHxJvSczA,All to well is the best ts song,13,0,1.0
3500,zAtHxJvSczA,In a song?? All Too Well is #That song,17,0,0.0
3501,zAtHxJvSczA,I love how Andy keeps trying to stir the pot regarding T Swift and not one of these older celebrities gives a shit,7,0,0.15555555555555553
3502,zAtHxJvSczA,She might not have that scarf but she sure has the face of a hound dog ...😕😕😕😕,0,0,0.5
3503,zAtHxJvSczA,Can't believe my video 10 Kittens 1st Day Outside has over 2 million views now! \nGo check it out and hit that subscribe button!  xoxo Sarina 😊 \n\nhttps://youtu.be/DcJk32AJckg,0,0,0.0
3504,zAtHxJvSczA,Maybe someone can use that scarf and silence Taylor swift.,19,5,0.0
3505,zAtHxJvSczA,it might not have been about jake?,4,0,0.0
3506,l_uNfGY3v8E,It may not look that bad in Florida but the Caribbean islands are the ones that got hit the most,11,1,-0.09999999999999992
3507,l_uNfGY3v8E,"What a lot of people don't realize is that even though it didn't completely obliterate Florida, there are many of the islands like the Bahamas and various other places that will never ever be the same again. This storm was a monster, but we're only focused on what it did to one place and not the rest.",8,0,0.07916666666666666
3508,l_uNfGY3v8E,Boohoo shpw the Caribbean. It's gone. Not all this happy white suburban homes without roofs. People in st marteen don't have roofs anymore either... OR HOMES,18,1,0.26666666666666666
3509,l_uNfGY3v8E,So where are the fly overs of Bermuda?,3,0,0.8
3510,l_uNfGY3v8E,Hi! Check out my channel for tv reviews and recommendations. Thanks :D,0,0,0.6
3511,l_uNfGY3v8E,"I am so sick of people saying not that bad,not everyone is rich or can afford to rebuild.",0,0,-0.16964285714285715
3512,l_uNfGY3v8E,Try to use appropriate adjectives to describe events rather than over exaggerating to get views like a below average YouTube editor....,0,0,0.175
3513,l_uNfGY3v8E,"It wasn't that bad in parts of Florida ,but it hit the Carribean horribly",0,0,-0.8499999999999999
3514,l_uNfGY3v8E,a horrible attempt to try and get us to freak out,0,0,-1.0
3515,l_uNfGY3v8E,"You know, spotlight should be shown where the hurricane was actually catastrophic: down in the Island Nations. Place where there is no more infrastructure anymore. Where people can't find food anymore because of the hurricane. Not where someone's boat is half sunken or a roof was torn off and that's it.",0,0,-0.14305555555555555
3516,l_uNfGY3v8E,So some trailers were missing some roofs and that's it? Wheres the flattened buildings or flooded city streets?,0,0,-0.2
3517,l_uNfGY3v8E,Why are they only showing mobile homes?\nAren't they less likely to go through a big storm like this?,0,0,-0.041666666666666664
3518,l_uNfGY3v8E,This isn’t bad at all... if you wanna see bad then look at the Caribbean islands where it looks like Hiroshima and Nagasaki at the end of World War II.,0,0,-0.6999999999999998
3519,l_uNfGY3v8E,From the air USA Today posts fake news.,0,0,-0.5
3520,l_uNfGY3v8E,That was not shit,0,0,0.1
3521,l_uNfGY3v8E,"I don't see how you can call it not bad when millions of people are without power and they are not going to have food or gasoline for a long time without having to resort to emergency support. Many of the homes are not going to be able to be rebuilt for years if at all and the property will be sold to the highest bidder and they will not rent to these people who are not able to live in their homes now. Supplies go to the richest people who can afford to rebuild and or live somewhere else while they are waiting for their homes. They are going to be waiting for insurance for homes, cars and boats. They are not going to be working for quite a while now. They are not going to be ok in a week. Many have no air conditioning now in the heat. This was not a weak 🌀. There are sick, elderly and disabled people trying to manage right now and figure out how to get by with the devestation. Weak 🌀, I don't think so",0,0,0.10761827458256026
3522,l_uNfGY3v8E,Wouldn't call this catastrophic,0,0,0.0
3523,l_uNfGY3v8E,All those Mullets.  Oh the horror.  The horror.,0,0,0.0
3524,l_uNfGY3v8E,Trailer park videos! Really? That's normal.,0,0,0.175
3525,l_uNfGY3v8E,It's not that bad,3,1,-0.6999999999999998
3526,l_uNfGY3v8E,"Lool. If you call this bad then that's nothing. Seriously these look right next to the ocean too. Trailer park looked decent. Did you plan the before and after, common? You can't call this catastrophic",0,0,-0.14682539682539683
3527,l_uNfGY3v8E,"They created the hurricane so they can push the NEW WORLD ORDER agenda, and destroy thousands of people houses so they wont have access to their homes and will be sent to the camps called FEMA CAMPS and they sound so familiar like they had in WW2 those camps are meant to kill as many people as they can! STAY WOKE GUY, dont be a sheep",0,0,0.2672727272727273
3528,l_uNfGY3v8E,*BUT DID IT DESTROY A GAMING CHAIR*,0,0,-0.2
3529,l_uNfGY3v8E,this is one of the worst videos I've ever seen,0,0,-1.0
3530,l_uNfGY3v8E,why is it all mobile homes on cement slabs and tin roof panel houses? of course these types of structures would break easy.,0,0,0.43333333333333335
3531,l_uNfGY3v8E,Lol!!! A few cardboard box houses were blown away.... devastating,0,0,-0.06666666666666665
3532,l_uNfGY3v8E,"First off. This was sad in comparison to Andrew. Second, WHO FILMS DRONE SHOTS IN 1x1?! It looks terrible.",0,0,-0.3125
3533,l_uNfGY3v8E,They gassed this hurricane up like it was bouta be the end of florida. The News Hyping it up like florida wasnt going to be on the map anymore,0,0,0.0
3534,l_uNfGY3v8E,"lmfao at anyone who thought this was actually gonna devastate anything. Florida experiences hurricanes quite frequently. As a result, most houses are built to last through a hurricane of substantial power. The media definitely overplayed this one lol",0,0,0.2333333333333333
3535,l_uNfGY3v8E,Has everyone forgot bout hurricane Harvey victims and are worried bout just Florida....?,0,0,0.0
3536,l_uNfGY3v8E,Catastrophic? Sit down.,0,0,-0.15555555555555559
3537,l_uNfGY3v8E,"We don't care about mobile homes. Show us more of regular houses, that's what's interesting because everyone knows a mobile home can't hold up to a hurricane.",0,0,0.3333333333333333
3538,l_uNfGY3v8E,Remember to pay your climate change dues so this shit won't happen anymore.,0,0,-0.2
3539,l_uNfGY3v8E,When you get click-baited by the news 😂,0,0,0.0
3540,l_uNfGY3v8E,bahahaha what's with all that saturation with before irma show us the real pics and don't make it too exaggerated yeesh,0,0,-0.15
3541,l_uNfGY3v8E,Its nit that bad from what i see,0,0,-0.6999999999999998
3542,l_uNfGY3v8E,It was a CAT 3 at landfall and quickly weakened soon after made worse only by the fact that many a moron live in aluminum boxes. Are those things even anchored beyond electric & gas connectors?,0,0,-0.0383838383838384
3543,l_uNfGY3v8E,Looks like a trailer park in texas after a small tornado.,0,0,-0.25
3544,l_uNfGY3v8E,Had to stop it 5 seconds in because of the music. Fail,0,0,-0.5
3545,l_uNfGY3v8E,Stop making houses out of cardboard,0,0,0.0
3546,l_uNfGY3v8E,We will rebuild we always do...LOVE TEXAS & FLORIDA 👍,0,0,0.0
3547,l_uNfGY3v8E,Never thought people would argue over who's city got destroyed the most.,0,0,0.5
3548,l_uNfGY3v8E,OH MY GOD!!! THE WORST STORM EVER SLIGHTLY DAMAGED SOME PROPERTIES! CALL FEMA! \n\nWhat is Florida's death toll again?,0,0,-0.6302083333333333
3549,l_uNfGY3v8E,Hurricane Andrew literally flattened entire suburbs. This is far far from a catastrophe.,0,0,0.06666666666666667
3550,l_uNfGY3v8E,It really wasn't as bad as it could be.,0,0,-0.24999999999999992
3551,l_uNfGY3v8E,"And the wolf went to the fourth little pig, who made his mobile home out of cheap materials and paper mache .......",0,0,0.07083333333333335
3552,l_uNfGY3v8E,Irma kicked the shit out of those trailer parks.,0,0,-0.2
3553,l_uNfGY3v8E,It's almost like Andrew.,0,0,0.0
3554,l_uNfGY3v8E,For a category 3 hurricane it's pretty okay,0,0,0.375
3555,l_uNfGY3v8E,Lmfao people are disappointed that is wasn't worse wtf is wrong with you people,0,0,-0.5375
3556,l_uNfGY3v8E,media trying to stir up more fear,0,0,0.5
3557,l_uNfGY3v8E,Make your houses out of stone you will feel like nothing ever happened,0,0,0.0
3558,l_uNfGY3v8E,I don't believe it,0,0,0.0
3559,l_uNfGY3v8E,"Trump is in trouble, he has to donate 2 million dollars now. He's going to be broke",0,0,-0.2
3560,l_uNfGY3v8E,Woow! So much for catastrophic damages. Even the trailer parks are still standing! 😂😂😂,0,0,0.25
3561,l_uNfGY3v8E,Whats with the horrible music? tf,0,0,-1.0
3562,l_uNfGY3v8E,"Other then some property damage and laying tress, irma did nothing",0,0,-0.125
3563,l_uNfGY3v8E,Thank you God that I did not get hit and my family in Florida is fine. God bless all the people that got hit. I wish the best for you,0,0,0.7083333333333334
3564,l_uNfGY3v8E,👍 Thumbs up if you were expecting a creepy clown with this music.   🤡,0,0,-0.5
3565,l_uNfGY3v8E,Building codes in Florida should make structure more wind resistant. But to me it looks corners were cute. And i cant feel sorry for people live in mobil homes next to the shore in hurricane alley (Florida). Thats just stupid.,0,0,-0.027272727272727264
3566,l_uNfGY3v8E,Really f#ck these square video's. Smartphone manufacturers: Here's bigger screen with higher resolution than ever! Facebook: Here is a square compressed to death video! Enjoy! ,0,0,0.27265625
3567,l_uNfGY3v8E,"I've lived in Florida- Miami, Melbourne, & Jacksonville- and the strangest universal truth becomes obvious after hurricanes: there are a LOT of trailer parks in Florida on some very high-dollar property. And even stranger is that these people will all rebuild in the same place, over and over again. It never ceases to amaze me that someone would want to live in such a flimsy homes knowing that they're going to see severe storms every few years.",0,0,0.01948051948051948
3568,l_uNfGY3v8E,what about mexico and cuba?,0,0,0.0
3569,l_uNfGY3v8E,i dont think it caused a lot of damage.,0,0,0.0
3570,l_uNfGY3v8E,"Houston got it bad, Florida came out not that bad",0,0,-0.6999999999999998
3571,l_uNfGY3v8E,"This is like a picnic in the park with Elmo. Anybody see damage in the Caribbean, Cuba, and the FL Keys.",0,0,0.0
3572,l_uNfGY3v8E,THIS IS NOT THAT BAD.  COULD'VE BEEN SO MUCH WORSE.,1,0,-0.5499999999999999
3573,l_uNfGY3v8E,"Y'all acting like Irma didn't hit the Caribbean, Puerto Rico and Cuba. Smh. It did damage plenty and it may not have damaged Florida on a massive scale but thank goodness for that.",1,0,0.0
3574,l_uNfGY3v8E,Show the carribeans! That's real catastrophe!,1,0,0.25
3575,l_uNfGY3v8E,They hyped this storm up to be absolutely devastating when it hit Florida but it was no where near that...smh,1,0,-0.45
3576,l_uNfGY3v8E,Meanwhile Barbuda got wiped off the planet ....,1,0,0.0
3577,l_uNfGY3v8E,"I like how they're only covering Florida but not the Carribean that got fucked by the strongest hurricane to be ever formed in the Atlantic at its strongest point (190 MPH Winds and 225 MPH Gusts) that even caused places like Barbuda to be Inhabitable (meaning you're not allowed to live there anymore) which the entirety of that island got 95-100% destroyed. And the dozens that also died throughout there. They didn't even cover Puerto Rico, which the US owns. Like shit...",2,0,-0.1659090909090909
3578,l_uNfGY3v8E,Irma: It's over! I have the high ground!,1,0,0.2
3579,l_uNfGY3v8E,Why not just go to the islands that actually got hit with cat 5 winds,1,0,0.0
3580,l_uNfGY3v8E,Irma wasn't that bad..,0,0,-0.6999999999999998
3581,l_uNfGY3v8E,Quit overhyping it. Andrew was worse.,0,0,-0.4
3582,l_uNfGY3v8E,https://youtu.be/wJBBlntDtEU,0,0,0.0
3583,l_uNfGY3v8E,Overhyped,0,0,0.0
3584,l_uNfGY3v8E,"THATS NOTHING, DENIED!",0,0,0.0
3585,l_uNfGY3v8E,lol nothing,0,0,0.8
3586,l_uNfGY3v8E,this has to be the most clickbait fraudulent claim of destruction I've ever seen. small tornadoes will do 10x the amount of damage this did. who's agenda are you fulfilling usa today???,3,1,0.125
3587,l_uNfGY3v8E,what overhyped bullshit,0,0,0.0
3588,l_uNfGY3v8E,Trump is a Cat 5 dumbass.😂😂😂,0,0,0.0
3589,l_uNfGY3v8E,gofundme.com/dragonmother,0,0,0.0
3590,l_uNfGY3v8E,Maybe its catastrophic because its a goddamn trailerpark,0,0,0.0
3591,l_uNfGY3v8E,Sarasota gets hit by Irma.\n\nhttps://www.youtube.com/watch?v=3YedAWzqUxg&t=6s,0,0,0.0
3592,l_uNfGY3v8E,Harvey was 10 times worse,0,0,-0.4
3593,l_uNfGY3v8E,My room looks worse,0,0,-0.4
3594,l_uNfGY3v8E,skip ad\ni need a doughnut,0,0,0.0
3595,l_uNfGY3v8E,Nah.. Just a drizzle,0,0,0.0
3596,l_uNfGY3v8E,Irma was overhyped,0,0,0.0
3597,l_uNfGY3v8E,Follow my Vlog bad boy,0,0,-0.6999999999999998
3598,l_uNfGY3v8E,FAKE NEWS!!,0,0,-0.78125
3599,l_uNfGY3v8E,Nice clickbait,0,0,0.6
3600,l_uNfGY3v8E,http://www.eaymusic.com/forum.php?x=68155,0,0,0.0
3601,l_uNfGY3v8E,Clickbait...,0,0,0.0
3602,l_uNfGY3v8E,Lol.,1,0,0.8
3603,l_uNfGY3v8E,This'll prove the Irma deniers wrong,1,0,-0.5
3604,l_uNfGY3v8E,"What the f ever, Harvey caused way worse deatruction... florida lost sum shingles and couple boats so fuckin what",2,2,-0.4
3605,l_uNfGY3v8E,So a few shingles missing is devistation?  Then Harvey must have been apocoltptic.,0,2,-0.2
3606,Rew50oYjRqA,Love this look on you boo!! Gorgeous as always!,3,0,0.828125
3607,Rew50oYjRqA,Your face looks fake.,0,0,-0.5
3608,Rew50oYjRqA,Gorgeous!  Love it!,0,0,0.75
3609,Rew50oYjRqA,A red/orange/burgundy look!! ❤️,0,0,0.0
3610,Rew50oYjRqA,😍 yass,0,0,0.0
3611,Rew50oYjRqA,Ughhhhhhhh you give me lyfeeeeeeeee *snap snap*,0,0,0.0
3612,Rew50oYjRqA,You should do a wearable matte eyeshadow look Casey! 😍☺️,0,0,0.0
3613,Rew50oYjRqA,❤️🙌🏻👏🏻😍,0,0,0.0
3614,Rew50oYjRqA,Lips NO...😳,0,0,0.0
3615,Rew50oYjRqA,Yesssss!!!!!  Perfection!!!!,0,0,0.0
3616,Rew50oYjRqA,this is gorgeousssss,0,0,0.0
3617,Rew50oYjRqA,😍😍😍😍😍,0,0,0.0
3618,Rew50oYjRqA,Casey! you're Trending! yasqueen,0,0,0.0
3619,Rew50oYjRqA,reasons guys have trust issues,1,0,0.0
3620,Rew50oYjRqA,pleaase do a PR Unboxing!,1,0,0.0
3621,Rew50oYjRqA,Beautiful look babe,0,0,0.85
3622,Rew50oYjRqA,Gorg,0,0,0.0
3623,Rew50oYjRqA,You're trending!!!!👏🏾👏🏾👏🏾👏🏾❤️,0,0,0.0
3624,Rew50oYjRqA,😍😍😍😍😍😍😍😍😍👍🏻👍🏻👏🏻👏🏻👏🏻🙌🏻🙌🏻🙌🏻🙌🏻🙌🏻🙌🏻👌🏻👌🏻👌🏻👌🏻,0,0,0.0
3625,Rew50oYjRqA,Liiivvvinnnngggg for that dark lip!!!,0,0,-0.29296875
3626,Rew50oYjRqA,Ugh this was gorgeous.,0,0,0.7
3627,Rew50oYjRqA,Trending!!!!,0,0,0.0
3628,Rew50oYjRqA,All matte eye look pleeeasseeee,0,0,0.0
3629,Rew50oYjRqA,Ugh so gorgeous!!!!!,0,0,1.0
3630,Rew50oYjRqA,Thot begone,0,0,0.0
3631,Rew50oYjRqA,SLAYYYYYYYYYYYYYYYYYYYYYYYYYYYYYYYYYYYYYYYYYYYYYYYYYYYYYYY,0,0,0.0
3632,Rew50oYjRqA,Love love love this look !,0,0,0.5416666666666666
3633,Rew50oYjRqA,"Girl, you're trending 💁🏼",0,0,0.0
3634,Rew50oYjRqA,So pretty,1,0,0.25
3635,Rew50oYjRqA,Its 99 degrees out but I'm about to go rock a dark lip because Casey is :-D,0,0,0.425
3636,Rew50oYjRqA,Bring on the fall looks girl! Love love love,0,0,0.5
3637,Rew50oYjRqA,@caseyholmes did u know nyx is in walgreens!? And/or your local drug store,0,0,0.0
3638,Rew50oYjRqA,Absolutely love this look and YOU LOOKED 10 YEARS YOUNGER with your hair down!!!!❤️❤️,0,0,0.25
3639,Rew50oYjRqA,you look so good,0,0,0.7
3640,Rew50oYjRqA,"Talking to Davis about your little diy fix cracked me up. I know that face, I've made it many times lol. When they see something you've fixed haha. I just love you even though I shop after each one of your videos 😶",0,0,0.31875000000000003
3641,Rew50oYjRqA,yeiiiii!!!! loooove love how the look turn out!... im a fall makeup person sooooo this makes me happy,0,0,0.7125
3642,Rew50oYjRqA,Gorgeous! Can you do a Fenty Beauty video?,0,0,0.875
3643,Rew50oYjRqA,"My boyfriend and I have a 10 week old Mastiff, and he loves the sound of people over the phone or computer.  I went out of the room quickly and left your video on and I came back and he was staring at the screen tilting his head lol so interested!",0,0,0.2779761904761905
3644,Rew50oYjRqA,"Was not ready for fall, but then saw your thumbnail and Ughhhhh so ready to dive right into the pumpkin spice abyss lol!!",0,0,0.3464285714285714
3645,Rew50oYjRqA,I love 💄 it looks great on you Love your video,0,0,0.6
3646,Rew50oYjRqA,You should do a video on how to use darker foundations to contour! :),0,0,0.5
3647,Rew50oYjRqA,I want a burnt orange monochromatic makeup look girl!,0,0,0.0
3648,Rew50oYjRqA,OMG so beautiful Casey!! How did that eyeliner do? Did it run on you? It looked so so promising and I am curious!! 🤔🤗🤗🤗,0,0,0.34791666666666665
3649,Rew50oYjRqA,I was doing my natural makeup for work then saw this video and now my look is fall😍😂,0,0,0.1
3650,Rew50oYjRqA,"Girl, don't leave me hangin. What was the fail foundation?",0,0,-0.5
3651,Rew50oYjRqA,As a guy this much makeup is a huge turn off. Just look at her shoulders and then her face she looks off. This is the type of girl you give a hug at a party and then look down at your new shirt ruined and caked in makeup. \nNatural beauty over fake any day. \nJust my opinion as a 22 year old.,0,0,0.03013468013468015
